{
  "Internal": {
    "ChargePointId": "jp-dc-01",
    "CentralSystemURI": "ws://127.0.0.1:8180/steve/websocket/CentralSystemService/",
    "ChargeBoxSerialNumber": "jp-dc-01",
    "ChargePointModel": "Joulepoint-DC",
    "ChargePointVendor": "JoulePoint",
    "FirmwareVersion": "0.0.1",
    "LogMessagesFormat": []
  },
  "Core": {
    "AuthorizeRemoteTxRequests": true,
    "ClockAlignedDataInterval": 900,
    "ConnectionTimeOut": 10,
    "ConnectorPhaseRotation": "0.RST,1.RST,2.RST,3.RST,4.RST,5.RST,6.RST,7.RST,8.RST,9.RST,10.RST,11.RST,12.RST",
    "GetConfigurationMaxKeys": 100,
    "HeartbeatInterval": 300,
    "LocalAuthorizeOffline": false,
    "LocalPreAuthorize": false,
    "MeterValuesAlignedData": "Energy.Active.Import.Register",
    "MeterValuesSampledData": "Energy.Active.Import.Register",
    "MeterValueSampleInterval": 0,
    "NumberOfConnectors": 12,
    "ResetRetries": 1,
    "StopTransactionOnEVSideDisconnect": true,
    "StopTransactionOnInvalidId": true,
    "StopTxnAlignedData": "Energy.Active.Import.Register",
    "StopTxnSampledData": "Energy.Active.Import.Register",
    "SupportedFeatureProfiles": "Core,FirmwareManagement,RemoteTrigger,Reservation,LocalAuthListManagement,SmartCharging",
    "TransactionMessageAttempts": 1,
    "TransactionMessageRetryInterval": 10,
    "UnlockConnectorOnEVSideDisconnect": true
  },
  "FirmwareManagement": {
    "SupportedFileTransferProtocols": "HTTPS"
  },
  "LocalAuthListManagement": {
    "LocalAuthListEnabled": true,
    "LocalAuthListMaxLength": 42,
    "SendLocalListMaxLength": 42
  },
  "SmartCharging": {
    "ChargeProfileMaxStackLevel": 42,
    "ChargingScheduleAllowedChargingRateUnit": "Current",
    "ChargingScheduleMaxPeriods": 42,
    "MaxChargingProfilesInstalled": 42
  },
  "Security": {
    "SecurityProfile": 0
  },
  "PnC": {
    "ISO15118CertificateManagementEnabled": false,
    "ISO15118PnCEnabled": false,
    "ContractValidationOffline": false
  },
  "CostAndPrice": {
    "CustomDisplayCostAndPrice": false
  }
}
