{
    "Internal": {
        "LogMessagesFormat": []
    },
    "Core": {
        "AuthorizationCacheEnabled": true,
        "AuthorizeRemoteTxRequests": false,
        "ClockAlignedDataInterval": 900,
        "ConnectionTimeOut": 10,
        "ConnectorPhaseRotation": "1.RST",
        "GetConfigurationMaxKeys": 100,
        "HeartbeatInterval": 86400,
        "LocalAuthorizeOffline": false,
        "LocalPreAuthorize": false,
        "MeterValuesAlignedData": "Energy.Active.Import.Register,Power.Active.Import,Voltage,Current.Import",
        "MeterValuesSampledData": "Energy.Active.Import.Register,Power.Active.Import,Voltage,Current.Import",
        "MeterValueSampleInterval": 0,
        "MinimumStatusDuration": 0,
        "NumberOfConnectors": 1,
        "ResetRetries": 1,
        "StopTransactionOnEVSideDisconnect": true,
        "StopTransactionOnInvalidId": true,
        "StopTxnAlignedData": "Energy.Active.Import.Register,Power.Active.Import,Voltage,Current.Import",
        "StopTxnSampledData": "Energy.Active.Import.Register,Power.Active.Import,Voltage,Current.Import",
        "SupportedFeatureProfiles": "Core,FirmwareManagement,RemoteTrigger,Reservation,LocalAuthListManagement,SmartCharging",
        "TransactionMessageAttempts": 1,
        "TransactionMessageRetryInterval": 10,
        "UnlockConnectorOnEVSideDisconnect": true
    },
    "FirmwareManagement": {
        "SupportedFileTransferProtocols": "FTP"
    },
    "LocalAuthListManagement": {
        "LocalAuthListEnabled": true,
        "LocalAuthListMaxLength": 42,
        "SendLocalListMaxLength": 42
    },
    "SmartCharging": {
        "ChargeProfileMaxStackLevel": 42,
        "ChargingScheduleAllowedChargingRateUnit": "Current",
        "ChargingScheduleMaxPeriods": 42,
        "MaxChargingProfilesInstalled": 42
    },
    "Security": {
        "SecurityProfile": 0
    },
    "PnC": {
        "ISO15118CertificateManagementEnabled": true,
        "ISO15118PnCEnabled": true,
        "ContractValidationOffline": true
    },
    "CostAndPrice": {
        "CustomDisplayCostAndPrice": false
    }
}
